<?xml version="1.0" encoding="UTF-8" standalone="no"?>
<LoL_WIQPM2 xmlns:xs="http://www.w3.org/2001/XMLSchema-instance" xs:noNamespaceSchemaLocation="XMLSchemaWIQPM2.xsd">
     <szponzorok>
          <szponzor sz_nev="Monster Energy">
               <tipus>Energiaital</tipus>
               <sz_orszag>USA</sz_orszag>
               <tulajdonos>Rodney Sacks</tulajdonos>
          </szponzor>
          <szponzor sz_nev="SteelSeries">
               <tipus>Gaming</tipus>
               <sz_orszag>Norvégia</sz_orszag>
               <tulajdonos>Ehtisham Rabbani</tulajdonos>
               <tulajdonos>Tino Soelberg</tulajdonos>
               <tulajdonos>Oluf Riddersholm</tulajdonos>
          </szponzor>
          <szponzor sz_nev="Twitch">
               <tipus>Streamingszolgáltatás</tipus>
               <sz_orszag>USA</sz_orszag>
               <tulajdonos>Twitch Interactive</tulajdonos>
          </szponzor>
     </szponzorok>
     <szp_csapatok>
          <szp_csapat csapat_nev="Fnatic" szp_csapat_azonosito="1" szp_nev="Monster Energy">
               <miota_szp>2017</miota_szp>
          </szp_csapat>
          <szp_csapat csapat_nev="Team Liquid" szp_csapat_azonosito="2" szp_nev="SteelSeries">
               <miota_szp>2018</miota_szp>
          </szp_csapat>
          <szp_csapat csapat_nev="PSG Talon" szp_csapat_azonosito="3" szp_nev="Twitch">
               <miota_szp>2020</miota_szp>
          </szp_csapat>
     </szp_csapatok>
     <jatekosok>
          <jatekos csapat_nev="Fnatic" j_azonosito="1">
               <j_nev>Humanoid</j_nev>
               <j_nemzetiseg>cseh</j_nemzetiseg>
               <aktiv>Igen</aktiv>
               <j_rang>62</j_rang>
               <pozicio>Mid</pozicio>
               <karrier_kezdete>2016</karrier_kezdete>
               <eletkor>23</eletkor>
          </jatekos>
          <jatekos csapat_nev="Fnatic" j_azonosito="2">
               <j_nev>Razork</j_nev>
               <j_nemzetiseg>spanyol</j_nemzetiseg>
               <aktiv>Igen</aktiv>
               <j_rang>167</j_rang>
               <pozicio>Jungle</pozicio>
               <karrier_kezdete>2016</karrier_kezdete>
               <eletkor>23</eletkor>
          </jatekos>
          <jatekos csapat_nev="Team Liquid" j_azonosito="3">
               <j_nev>CoreJJ</j_nev>
               <j_nemzetiseg>dél koreai</j_nemzetiseg>
               <aktiv>Igen</aktiv>
               <j_rang>69</j_rang>
               <pozicio>Support</pozicio>
               <karrier_kezdete>2013</karrier_kezdete>
               <eletkor>29</eletkor>
          </jatekos>
     </jatekosok>
     <csapatok>
          <csapat cs_nev="Fnatic">
               <cs_nemzetiseg>Anglia</cs_nemzetiseg>
               <cs_rang>14</cs_rang>
               <regio>EMEA</regio>
          </csapat>
          <csapat cs_nev="Team Liquid">
               <cs_nemzetiseg>Hollandia</cs_nemzetiseg>
               <cs_rang>15</cs_rang>
               <regio>NA</regio>
          </csapat>
          <csapat cs_nev="PSG Talon">
               <cs_nemzetiseg>Kína</cs_nemzetiseg>
               <cs_rang>22</cs_rang>
               <regio>PCS</regio>
          </csapat>
     </csapatok>
     <edzok>
          <edzo csapat_nev="Fnatic" e_azonosito="1">
               <e_nev>Nightshare</e_nev>
               <miota>2023</miota>
               <korabbi_csapat>Immortals</korabbi_csapat>
          </edzo>
          <edzo csapat_nev="Team Liquid" e_azonosito="2">
               <e_nev>Spawn</e_nev>
               <miota>2023</miota>
               <korabbi_csapat>TL Challengers</korabbi_csapat>
          </edzo>
          <edzo csapat_nev="PSG Talon" e_azonosito="3">
               <e_nev>CorGi</e_nev>
               <miota>2021</miota>
               <korabbi_csapat>EDward Gaming</korabbi_csapat>
          </edzo>
     </edzok>
     <esemenyek>
          <esemeny csapat_nev="Fnatic" es_azonosito="1">
               <es_nev>Rift Rivals 2018 NA-EU</es_nev>
               <ev>2018</ev>
               <nyeremeny>20000</nyeremeny>
               <helyszin>
                    <es_orszag>US</es_orszag>
                    <varos>Los Angeles</varos>
                    <hely>Riot North American Studios</hely>
               </helyszin>
          </esemeny>
          <esemeny csapat_nev="Fnatic" es_azonosito="2">
               <es_nev>EU LCS 2015 Summer Playoffs</es_nev>
               <ev>2015</ev>
               <nyeremeny>50000</nyeremeny>
               <helyszin>
                    <es_orszag>Svédország</es_orszag>
                    <varos>Stockholm</varos>
                    <hely>Hovet Arena</hely>
               </helyszin>
          </esemeny>
          <esemeny csapat_nev="Team Liquid" es_azonosito="3">
               <es_nev> LCS 2022 Lock In</es_nev>
               <ev>2022</ev>
               <nyeremeny>150000</nyeremeny>
               <helyszin>
                    <es_orszag>US</es_orszag>
                    <varos>Los Angeles</varos>
                    <hely>LCS Studio</hely>
               </helyszin>
          </esemeny>
     </esemenyek>
</LoL_WIQPM2>
